{
  "metadata": {
    "schema_version": "1.6.0",
    "last_updated": "2026-03-02"
  },
  "enums": {
    "priority_levels": [
      {
        "value": "P0",
        "definition": "Critical: production-breaking or patient-safety/security risk; address immediately."
      },
      {
        "value": "P1",
        "definition": "High: major functionality degraded or high regression risk; schedule next."
      },
      {
        "value": "P2",
        "definition": "Normal: meaningful improvement or bugfix; prioritize with roadmap context."
      },
      {
        "value": "P3",
        "definition": "Low: polish, cleanup, or non-urgent enhancement."
      }
    ],
    "risk_levels": [
      {
        "value": "high",
        "definition": "Likely to cause data loss, auth bypass, or severe workflow failure if wrong."
      },
      {
        "value": "medium",
        "definition": "Could disrupt workflows or require manual recovery; moderate blast radius."
      },
      {
        "value": "low",
        "definition": "Limited impact; straightforward rollback/recovery expected."
      }
    ],
    "status_values": [
      {
        "value": "open",
        "definition": "Tracked and ready for intake/execution."
      },
      {
        "value": "in_progress",
        "definition": "Actively being implemented or investigated."
      },
      {
        "value": "blocked",
        "definition": "Cannot proceed pending dependency/decision/access."
      },
      {
        "value": "done",
        "definition": "Completed and close-looped with dated entry."
      }
    ],
    "tag_vocabulary": [
      {
        "value": "ui",
        "definition": "Interface/UX behavior and rendering."
      },
      {
        "value": "ios",
        "definition": "Apple device or Safari-specific behavior."
      },
      {
        "value": "pwa",
        "definition": "Progressive web app install/offline shell concerns."
      },
      {
        "value": "offline",
        "definition": "Offline queueing/sync and local persistence paths."
      },
      {
        "value": "supabase",
        "definition": "Supabase platform, SQL, RLS, or client usage."
      },
      {
        "value": "auth",
        "definition": "Authentication/authorization concerns."
      },
      {
        "value": "sync",
        "definition": "Sync pipeline and idempotent mutation handling."
      },
      {
        "value": "data-model",
        "definition": "Schema, relationships, or record-shape correctness."
      },
      {
        "value": "api",
        "definition": "Serverless endpoint logic and request/response behavior."
      },
      {
        "value": "performance",
        "definition": "Latency, throughput, or resource-usage optimization."
      },
      {
        "value": "reliability",
        "definition": "Fault tolerance, retries, and consistency guarantees."
      },
      {
        "value": "security",
        "definition": "Access control, privacy, and exploit prevention."
      },
      {
        "value": "migration",
        "definition": "Database/data migration planning and execution."
      },
      {
        "value": "docs",
        "definition": "Documentation or workflow process updates."
      },
      {
        "value": "cleanup",
        "definition": "Refactors, debt paydown, and housekeeping."
      },
      {
        "value": "email",
        "definition": "Notification or email delivery behavior."
      },
      {
        "value": "lcp",
        "definition": "Largest Contentful Paint and first-render metrics."
      },
      {
        "value": "notifications",
        "definition": "In-app or push notification behavior."
      }
    ],
    "scope_values": [
      {
        "value": "current",
        "definition": "Applies to the current deployment. Default when field is absent."
      },
      {
        "value": "deferred",
        "definition": "Valid concern but not applicable at current deployment scale or configuration. See reactivate_when for trigger condition."
      }
    ],
    "agent_values": {
      "field_type": "array \u2014 one or more of the values below. Required on all open items.",
      "values": [
        {
          "value": "codex",
          "definition": "Task is suitable for Codex: spec is complete, implementation is mechanical or pattern-matching, no design decisions required before coding."
        },
        {
          "value": "claude",
          "definition": "Task requires Claude: spec is incomplete, involves investigation, architectural judgment, or design decisions before coding."
        },
        {
          "value": "unassigned",
          "definition": "Agent not yet determined. Surface for triage before execution."
        }
      ],
      "note": "Use [\"codex\", \"claude\"] when either agent can handle the task. Never use an empty array \u2014 use [\"unassigned\"] if unsure."
    },
    "reactivate_triggers": [
      {
        "value": "deployment_scope_change",
        "definition": "Re-evaluate when the user base or deployment model changes (e.g. adding users beyond the current two-person setup). Requires explicit human decision \u2014 no automatic condition check."
      },
      {
        "value": "query_volume_sufficient",
        "definition": "Re-evaluate when the app has sustained real-user query traffic sufficient to make index usage data meaningful."
      },
      {
        "value": "api_capacity_available",
        "definition": "Re-evaluate when Vercel function slot count is no longer a constraint (e.g. plan upgrade or function consolidation)."
      }
    ]
  },
  "open_items": [
    {
      "id": "DN-052",
      "status": "in_progress",
      "priority": "P1",
      "risk": "high",
      "scope": "current",
      "agent": ["codex", "claude"],
      "tags": ["api", "auth", "reliability", "security", "notifications"],
      "file": "pt-rebuild/public/pt_view.html, pt-rebuild/public/index.html, pt-rebuild/pages/pt-view.js, pt-rebuild/components/MessagesModal.js, pt-rebuild/api/logs.js",
      "issue": "Therapist outbound messages can be self-addressed (`sender_id === recipient_id`), causing silent non-delivery to patient and misrouted unread-email notifications.",
      "resolved": null,
      "context": "Confirmed in production data: a therapist-authored message row was inserted with sender_id and recipient_id both equal to therapist user ID, while patient outbound rows correctly target therapist ID. Implemented: UI recipient now resolves from current thread participant with role-based fallback in both legacy and Next.js flows; API now rejects self-recipient and validates therapist/patient assignment relationship before insert. Pending: runtime regression verification for two-user and multi-patient therapist scenarios.",
      "constraints_caveats": "Keep DN-052 in_progress until runtime validation completes. Required checks: therapist reply reaches patient, patient reply reaches assigned therapist, self-recipient returns 400, unassigned recipient returns 403, and existing read/archive behavior remains intact."
    },
    {
      "id": "DN-051",
      "status": "open",
      "priority": "P2",
      "risk": "low",
      "scope": "current",
      "agent": [
        "codex"
      ],
      "tags": [
        "migration",
        "ui",
        "pwa"
      ],
      "file": "pt-rebuild/components/PwaInstallPrompt.js",
      "issue": "Phase 4h: Port PWA install prompt from public/index.html into components/PwaInstallPrompt.js. Preserve service worker registration and install prompt behavior.",
      "resolved": null,
      "context": "Part of Phase 4 index.html migration (DN-045). Port the beforeinstallprompt listener and install button display logic from index.html into a standalone React component. Claude verifies on mobile preview.",
      "constraints_caveats": "No onClick \u2014 use onPointerUp. 44px touch targets. Must not break offline shell behavior."
    },
    {
      "id": "DN-050",
      "status": "open",
      "priority": "P2",
      "risk": "low",
      "scope": "current",
      "agent": [
        "codex"
      ],
      "tags": [
        "migration",
        "ui"
      ],
      "file": "pt-rebuild/components/ExercisePicker.js, pt-rebuild/components/ExercisePicker.module.css",
      "issue": "Phase 4f: Add exercise sort mode selector + drag-and-drop manual ordering to ExercisePicker. Sort modes: custom/manual, body area, recent activity, alphabetical, PT/program order fallback. Persist preference to localStorage (user-scoped key). Drag-and-drop: pointer events, onPointerUp, 44px grip handle, drag ghost while moving.",
      "resolved": null,
      "context": "Part of Phase 4 index.html migration (DN-045). Resolves DN-012. Sort preference key: pt_sort_mode_${userId}. Custom order key: pt_exercise_order_${userId}. No onclick/click handlers \u2014 iOS-safe only. Claude reviews and fixes if needed, then verifies on iOS preview.",
      "constraints_caveats": "No onClick or click events. onPointerUp only. touch-action: manipulation. Drag ghost must be visible during move. localStorage keys must include userId to be user-scoped."
    },
    {
      "id": "DN-049",
      "status": "open",
      "priority": "P2",
      "risk": "low",
      "scope": "current",
      "agent": [
        "codex"
      ],
      "tags": [
        "migration",
        "ui"
      ],
      "file": "pt-rebuild/components/TimerPanel.js, pt-rebuild/components/TimerPanel.module.css, pt-rebuild/hooks/useTimerSpeech.js",
      "issue": "Phase 4d: Port rep counter, hold timer, duration timer, and voice cues from public/index.html into TimerPanel + useTimerSpeech hook. Web Audio API (iOS-safe beep). Web Speech API for voice cues.",
      "resolved": null,
      "context": "Part of Phase 4 index.html migration (DN-045). TimerPanel receives exercise and set context as props. useTimerSpeech manages timer state and speech synthesis. Claude verifies iOS audio + speech behavior on preview.",